Symbol,Name,Last Sale,Net Change,% Change,Market Cap,Country,IPO Year,Volume,Sector,Industry
RAD,Rite Aid Corporation Common Stock,$14.83,0.40,2.772%,816937422.00,United States,,1509398,Health Care,Medical/Nursing Services
RAMP,LiveRamp Holdings Inc. Common Stock,$46.77,-0.70,-1.475%,3176720546.00,United States,2018,992317,Technology,EDP Services
RBA,Ritchie Bros. Auctioneers Incorporated Common Stock,$59.21,0.93,1.596%,6535093910.00,Canada,,970754,Consumer Services,Business Services
RBAC,RedBall Acquisition Corp. Class A Ordinary Shares,$9.76,0.00,0.00%,701500000.00,United States,2020,44416,Finance,Business Services
RBC,Regal Beloit Corporation Common Stock,$145.46,-1.14,-0.778%,5919660815.00,United States,,129454,Consumer Durables,Metal Fabrications
RBLX,Roblox Corporation Class A Common Stock,$85.51,7.59,9.741%,48726288401.00,,2021,16019848,Technology,EDP Services
RC,Ready Capital Corproation Common Stock,$14.91,-0.26,-1.714%,1062060502.00,United States,2013,330978,Consumer Services,Real Estate Investment Trusts
RC^C,Ready Capital Corporation 6.25% Series C Cumulative Convertible Preferred Stock,$25.76,-0.02,-0.078%,,United States,,489,,
RC^E,Ready Capital Corporation 6.50% Series E Cumulative Redeemable Preferred Stock,$25.46,-0.02,-0.078%,,United States,,8559,,
RCA,Ready Capital Corporation 7.00% Convertible Senior Notes due 2023,$27.04,0.37,1.387%,0.00,United States,2017,1052,Consumer Services,Real Estate Investment Trusts
RCB,Ready Capital Corporation 6.20% Senior Notes due 2026,$26.76,0.00,0.00%,0.00,United States,2019,27,,
RCC,Ready Capital Corporation 5.75% Senior Notes due 2026,$25.89,-0.13,-0.50%,,United States,2021,53156,Finance,Finance Companies
RCI,Rogers Communication Inc. Common Stock,$50.60,-0.51,-0.998%,25549221091.00,Canada,,240141,Consumer Services,Telecom
RCL,D/B/A Royal Caribbean Cruises Ltd. Common Stock,$77.40,-1.52,-1.926%,19713331699.00,United States,1993,3013090,Transportation,Transportation Services
RCS,PIMCO Strategic Income Fund Inc.,$8.12,0.00,0.00%,359966713.00,United States,1994,152472,Finance,Investment Managers
RCUS,Arcus Biosciences Inc. Common Stock,$28.24,0.98,3.595%,2016167605.00,,2018,582548,Health Care,Major Pharmaceuticals
RDN,Radian Group Inc. Common Stock,$22.84,-0.13,-0.566%,4236591600.00,United States,,761919,Finance,Property-Casualty Insurers
RDS/B,Royal Dutch Shell PLC,$40.35,-0.19,-0.469%,,Netherlands,,4186976,,
RDY,Dr. Reddy's Laboratories Ltd Common Stock,$64.45,0.08,0.124%,10687660553.00,India,,119395,Health Care,Major Pharmaceuticals
RE,Everest Re Group Ltd. Common Stock,$262.75,0.08,0.03%,10476580039.00,Bermuda,,272971,Finance,Property-Casualty Insurers
RELX,RELX PLC PLC American Depositary Shares (Each representing One Ordinary Share),$29.85,0.03,0.101%,57723633798.00,United Kingdom,2015,1092955,Consumer Services,Publishing
RENN,Renren Inc. American Depositary Shares each representing fifteen Class A ordinary shares,$9.56,0.21,2.246%,229625043.00,China,2011,26197,Technology,EDP Services
RERE,AiHuiShou International Co. Ltd. American Depositary Shares (every three of which representing two Class A ordinary shares),$12.74,0.14,1.111%,2836367811.00,,2021,238694,,
RES,RPC Inc. Common Stock,$3.81,-0.14,-3.544%,821913911.00,United States,,393653,Energy,Oilfield Services/Equipment
REV,Revlon Inc. New Common Stock,$11.47,-0.42,-3.532%,615397123.00,United States,1996,122317,Consumer Non-Durables,Package Goods/Cosmetics
REVG,REV Group Inc. Common Stock,$15.31,-0.23,-1.48%,991198428.00,United States,2017,121746,Capital Goods,Industrial Machinery/Components
REX,REX American Resources Corporation,$80.375,-2.025,-2.458%,481607000.00,United States,,3846,Basic Industries,Automotive Aftermarket
REXR,Rexford Industrial Realty Inc. Common Stock,$61.69,-0.25,-0.404%,8497197997.00,United States,2013,230348,Consumer Services,Real Estate Investment Trusts
REXR^A,Rexford Industrial Realty Inc. 5.875% Series A Cumulative Redeemable Preferred Stock,$25.15,-0.01,-0.04%,,United States,,16757,,
REXR^B,Rexford Industrial Realty Inc. 5.875% Series B Cumulative Redeemable Preferred Stock,$26.30,-0.0592,-0.225%,,United States,,2149,,
REXR^C,Rexford Industrial Realty Inc. 5.625% Series C Cumulative Redeemable Preferred Stock par value $0.01 per share,$28.00,0.00,0.00%,,United States,,100,,
REZI,Resideo Technologies Inc. Common Stock ,$30.01,-1.88,-5.895%,4326930059.00,,2018,681173,Miscellaneous,Diversified Manufacture
RF,Regions Financial Corporation Common Stock,$19.90,-0.06,-0.301%,19004500000.00,United States,,4344029,Finance,Major Banks
RF^B,Regions Financial Corporation Depositary Shares Representing 1/40th Perpetual Preferred Series B,$28.86,-0.10,-0.345%,,United States,,40441,,
RF^C,Regions Financial Corporation Depositary Shares each Representing a 1/40th Interest in a  Share of 5.700% Fixed-to-Floating Rate Non-Cumulative  Perpetual Preferred Stock Series C,$29.16,-0.19,-0.647%,,United States,,26399,,
RF^E,Regions Financial Corporation Depositary Shares Each Representing a 1/40th Interest in a Share of 4.45% Non-Cumulative Perpetual Preferred Stock Series E,$26.10,-0.14,-0.534%,,United States,,39567,,
RFI,Cohen & Steers Total Return Realty Fund Inc. Common Stock,$15.8898,-0.1102,-0.689%,417116768.00,United States,1993,44045,Finance,Investment Managers
RFL,Rafael Holdings Inc. Class B Common Stock,$54.095,0.735,1.377%,958264850.00,United States,2018,26890,Finance,Real Estate
RFM,RiverNorth Flexible Municipal Income Fund Inc. Common Stock,$24.45,0.19,0.783%,149504391.00,,2020,38626,Finance,Trusts Except Educational Religious and Charitable
RFMZ,RiverNorth Flexible Municipal Income Fund II Inc. Common Stock,$21.05,-0.07,-0.331%,0.00,,2021,79960,Finance,Trusts Except Educational Religious and Charitable
RFP,Resolute Forest Products Inc. Common Stock,$11.75,-0.28,-2.328%,929320625.00,Canada,,430337,Basic Industries,Paper
RGA,Reinsurance Group of America Incorporated Common Stock,$118.67,-3.06,-2.514%,8069196514.00,United States,,390728,Finance,Life Insurance
RGR,Sturm Ruger & Company Inc. Common Stock,$82.865,1.685,2.076%,1458142259.00,United States,,177845,Miscellaneous,Arms/Ammunition
RGS,Regis Corporation Common Stock,$7.31,-0.15,-2.011%,261623584.00,United States,1991,101924,Consumer Services,Other Consumer Services
RGT,Royce Global Value Trust Inc. Common Stock,$15.37,-0.06,-0.389%,86084158.00,,2013,4637,Finance,Trusts Except Educational Religious and Charitable
RH,RH Common Stock,$689.31,14.32,2.122%,14496447102.00,United States,2012,349385,Consumer Services,Other Specialty Stores
RHI,Robert Half International Inc. Common Stock,$99.47,-0.32,-0.321%,11137659978.00,United States,,611758,Technology,Diversified Commercial Services
RHP,Ryman Hospitality Properties Inc. (REIT),$75.64,-3.06,-3.888%,4165150033.00,United States,,317193,Consumer Services,Real Estate Investment Trusts
RICE,Rice Acquisition Corp. Class A Common Stock,$17.00,-0.20,-1.163%,504200450.00,United States,2020,95715,Finance,Finance: Consumer Services
RIG,Transocean Ltd (Switzerland) Common Stock,$3.375,-0.085,-2.457%,2197597314.00,Switzerland,,11580918,Energy,Oil & Gas Production
RIO,Rio Tinto Plc Common Stock,$85.56,0.59,0.694%,138529077645.00,Australia,2002,2014216,Basic Industries,Steel/Iron Ore
RIV,RiverNorth Opportunities Fund Inc. Common Stock,$18.73,0.16,0.862%,221656945.00,,2015,81339,Finance,Finance Companies
RJF,Raymond James Financial Inc. Common Stock,$135.40,1.52,1.135%,18536260000.00,United States,,373315,Finance,Investment Bankers/Brokers/Service
RKT,Rocket Companies Inc. Class A Common Stock,$17.61,0.08,0.456%,2403306647.00,United States,2020,2333235,Finance,Finance: Consumer Services
RKTA,Rocket Internet Growth Opportunities Corp. Class A Ordinary Shares,$9.66,-0.04,-0.412%,322402500.00,,2021,1632,,
RL,Ralph Lauren Corporation Common Stock,$120.745,-2.395,-1.945%,8875886707.00,United States,1997,833499,Consumer Non-Durables,Apparel
RLGY,Realogy Holdings Corp. Common Stock,$17.175,-0.125,-0.723%,2002333652.00,United States,2012,1502805,Finance,Real Estate
RLI,RLI Corp. Common Stock (DE),$109.25,-0.66,-0.60%,4940934273.00,United States,,63590,Finance,Property-Casualty Insurers
RLJ,RLJ Lodging Trust Common Shares of Beneficial Interest $0.01 par value,$14.035,-0.535,-3.672%,2314620621.00,United States,2011,517311,Consumer Services,Real Estate Investment Trusts
RLJ^A,RLJ Lodging Trust $1.95 Series A Cumulative Convertible  Preferred Shares,$28.65,0.01,0.035%,,United States,,20615,,
RLX,RLX Technology Inc. American Depositary Shares each representing the right to receive one (1) Class A ordinary share,$4.53,0.07,1.57%,7115681282.00,,2021,4788902,Consumer Non-Durables,Farming/Seeds/Milling
RM,Regional Management Corp. Common Stock,$57.91,-1.02,-1.731%,596090041.00,United States,2012,48188,Finance,Finance: Consumer Services
RMAX,RE/MAX Holdings Inc. Class A Common Stock,$34.49,-0.07,-0.203%,651551245.00,,2013,302699,Finance,Real Estate
RMD,ResMed Inc. Common Stock,$277.98,3.29,1.198%,40451046939.00,United States,,444643,Health Care,Medical/Dental Instruments
RMI,RiverNorth Opportunistic Municipal Income Fund Inc. Common Stock,$23.63,-0.17,-0.714%,150600323.00,,2018,1102,Finance,Finance/Investors Services
RMM,RiverNorth Managed Duration Municipal Income Fund Inc. Common Stock,$21.34,-0.01,-0.047%,421241293.00,,2019,40892,Finance,Trusts Except Educational Religious and Charitable
RMO,Romeo Power Inc. Class A Common Stock,$6.85,0.21,3.163%,898701848.00,,2019,2685516,Capital Goods,Automotive Aftermarket
RMPL^,RiverNorth Specialty Finance Corporation 5.875% ,$25.45,-0.02,-0.079%,,,,891,,
RMT,Royce Micro-Cap Trust Inc. Common Stock,$12.07,0.05,0.416%,528240991.00,United States,,110641,Finance,Investment Managers
RNG,RingCentral Inc. Class A Common Stock,$263.33,15.90,6.426%,23929589723.00,,2013,1526872,Technology,EDP Services
RNGR,Ranger Energy Services Inc. Class A Common Stock,$7.84,-0.01,-0.127%,140310238.00,United States,2017,12306,Energy,Oilfield Services/Equipment
RNP,Cohen & Steers REIT and Preferred and Income Fund Inc. Common Shares,$26.97,0.22,0.822%,1283291745.00,United States,2003,121892,Finance,Investment Managers
RNR,RenaissanceRe Holdings Ltd. Common Stock,$155.93,0.51,0.328%,7345143307.00,Bermuda,,223255,Finance,Property-Casualty Insurers
RNR^E,RenaissanceRe Holdings Ltd. 5.375% Series E Preference Shares,$25.2441,-0.0059,-0.023%,,Bermuda,,9321,,
RNR^F,RenaissanceRe Holdings Ltd. Depositary Shares each Representing a 1/1000th Interest in a 5.750% Series F Preference Share,$27.00,-0.18,-0.662%,,Bermuda,,17115,,
RNR^G,RenaissanceRe Holdings Ltd. Depositary Shares each representing a 1/1000th interest in a share of 4.20% Series G Preference Shares,$25.54,-0.05,-0.195%,,Bermuda,,27837,,
ROG,Rogers Corporation Common Stock,$195.53,2.62,1.358%,3662109135.00,United States,,43380,Capital Goods,Industrial Machinery/Components
ROK,Rockwell Automation Inc. Common Stock,$313.99,-0.34,-0.108%,36430916451.00,United States,,455995,Capital Goods,Industrial Machinery/Components
ROL,Rollins Inc. Common Stock,$37.68,-0.48,-1.258%,18541547647.00,United States,,999921,Technology,Industrial Specialties
RONI,Rice Acquisition Corp. II Class A Ordinary Shares,$9.72,-0.13,-1.32%,0.00,,2021,5588,,
ROP,Roper Technologies Inc. Common Stock,$485.17,-2.79,-0.572%,51148486393.00,United States,1992,153336,Capital Goods,Industrial Machinery/Components
ROSS,Ross Acquisition Corp II Class A Ordinary Shares,$9.74,0.00,0.00%,420037500.00,,2021,55344,,
ROT,Rotor Acquisition Corp. Class A Common Stock,$9.96,0.03,0.302%,343620000.00,,2021,162811,Finance,Finance: Consumer Services
RPAI,Retail Properties of America Inc. Class A Common Stock,$12.54,-0.32,-2.488%,2693565277.00,United States,2012,1581567,Consumer Services,Real Estate Investment Trusts
RPM,RPM International Inc. Common Stock,$85.17,0.03,0.035%,11052854902.00,United States,,351573,Basic Industries,Paints/Coatings
RPT,RPT Realty Common Stock,$12.77,-0.26,-1.995%,1024013530.00,United States,,204609,Consumer Services,Real Estate Investment Trusts
RPT^D,RPT Realty 7.25% ,$57.90,0.62,1.082%,,United States,,6480,,
RQI,Cohen & Steers Quality Income Realty Fund Inc Common Shares,$16.20,0.09,0.559%,2174740310.00,United States,2002,284384,Finance,Trusts Except Educational Religious and Charitable
RRC,Range Resources Corporation Common Stock,$14.50,-0.30,-2.027%,3621720260.00,United States,,2389799,Energy,Oil & Gas Production
RRD,R.R. Donnelley & Sons Company Common Stock,$5.84,0.10,1.742%,425152000.00,United States,,683098,Consumer Services,Recreational Products/Toys
RS,Reliance Steel & Aluminum Co. Common Stock (DE),$153.32,0.59,0.386%,9733243611.00,United States,1994,195869,Basic Industries,Metal Fabrications
RSF,RiverNorth Specialty Finance Corporation,$19.64,0.10,0.512%,89486969.00,,2019,18038,Finance,Investment Managers
RSG,Republic Services Inc. Common Stock,$117.82,-0.49,-0.414%,37509747098.00,United States,1998,763677,Public Utilities,Environmental Services
RSI,Rush Street Interactive Inc. Class A Common Stock,$12.67,1.59,14.35%,2776749142.00,,2020,3886510,Consumer Services,Services-Misc. Amusement & Recreation
RSKD,Riskified Ltd. Class A Ordinary Shares,$28.84,0.59,2.088%,4545919362.00,,2021,550845,,
RTP,Reinvent Technology Partners Class A Ordinary Shares,$10.50,0.91,9.489%,905625000.00,United States,2020,2538935,Finance,Business Services
RTX,Raytheon Technologies Corporation Common Stock,$87.08,-0.50,-0.571%,131306024164.00,United States,,2757368,Capital Goods,Aerospace
RVI,Retail Value Inc. Common Stock ,$24.75,0.06,0.243%,522649463.00,United States,2018,67382,Consumer Services,Real Estate Investment Trusts
RVLV,Revolve Group Inc. Class A Common Stock,$65.29,0.03,0.046%,4750766914.00,,2019,893379,Consumer Services,Catalog/Specialty Distribution
RVT,Royce Value Trust Inc. Common Stock,$18.64,0.06,0.323%,1900771072.00,United States,1986,170330,Finance,Trusts Except Educational Religious and Charitable
RWT,Redwood Trust Inc. Common Stock,$12.05,-0.23,-1.873%,1362317835.00,United States,1995,862460,Consumer Services,Real Estate Investment Trusts
RXN,Rexnord Corporation Common Stock,$58.52,-0.02,-0.034%,7087085492.00,United States,2012,381518,Capital Goods,Industrial Machinery/Components
RY,Royal Bank Of Canada Common Stock,$102.80,-0.01,-0.01%,146499909200.00,Canada,,589115,Finance,Commercial Banks
RY^T,Royal Bank Of Canada 6.750% Fixed Rate/Floating Rate Noncumulative First Preferred Shares Series C-2,$28.675,0.425,1.504%,,Canada,,279,,
RYAM,Rayonier Advanced Materials Inc. Common Stock,$6.87,-0.29,-4.05%,436913815.00,United States,2014,254318,Basic Industries,Industrial Specialties
RYAN,Ryan Specialty Group Holdings Inc. Class A Common Stock,$30.13,0.39,1.311%,7805657797.00,,2021,379734,,
RYB,RYB Education Inc. American depositary shares each representing one Class A ordinary share,$3.18,0.06,1.923%,87724580.00,,2017,7099,Miscellaneous,Other Consumer Services
RYI,Ryerson Holding Corporation Common Stock,$19.66,0.80,4.242%,756410518.00,United States,2014,217939,Capital Goods,Office Equipment/Supplies/Services
RYN,Rayonier Inc. REIT Common Stock,$37.04,0.10,0.271%,5234489355.00,United States,,736684,Consumer Services,Real Estate Investment Trusts
RZA,Reinsurance Group of America Incorporated 6.20% Fixed-to-Floating Rate Subordinated Debentures due 2042,$26.95,-0.15,-0.554%,0.00,United States,,17271,Finance,Life Insurance
RZB,Reinsurance Group of America Incorporated 5.75% Fixed-To-Floating Rate Subordinated Debentures due 2056,$28.98,-0.04,-0.138%,0.00,United States,2016,25993,Finance,Life Insurance
S,SentinelOne Inc. Class A Common Stock,$50.61,-0.28,-0.55%,12974950430.00,,2021,729970,,
SA,Seabridge Gold Inc. Ordinary Shares (Canada),$17.08,-0.60,-3.394%,1288502697.00,Canada,,276109,Basic Industries,Precious Metals
SAF,Saratoga Investment Corp 6.25% Notes due 2023,$25.34,-0.04,-0.158%,0.00,United States,2018,10455,Finance,Finance Companies
SAFE,Safehold Inc. Common Stock,$93.91,0.19,0.203%,5008148741.00,United States,2017,88467,Consumer Services,Real Estate
SAH,Sonic Automotive Inc. Common Stock,$51.80,-0.67,-1.277%,2160886106.00,United States,1997,241102,Consumer Services,Other Specialty Stores
SAIC,SCIENCE APPLICATIONS INTERNATIONAL CORPORATION Common Stock,$82.24,-0.28,-0.339%,4766563621.00,,,269738,Technology,EDP Services
SAIL,SailPoint Technologies Holdings Inc. Common Stock,$49.53,0.04,0.081%,4554813966.00,United States,2017,544100,Technology,Computer Software: Prepackaged Software
SAK,Saratoga Investment Corp 7.25% Notes due 2025,$26.54,-0.06,-0.226%,0.00,United States,2020,3160,Finance,Finance Companies
SAM,Boston Beer Company Inc. (The) Common Stock,$684.52,27.80,4.233%,8407134313.00,United States,,360501,Consumer Non-Durables,Beverages (Production/Distribution)
SAN,Banco Santander S.A. Sponsored ADR (Spain),$3.82,-0.03,-0.779%,66133852070.00,Spain,,1846375,Finance,Commercial Banks
SAND          ,Sandstorm Gold Ltd. Ordinary Shares (Canada),$7.08,-0.26,-3.542%,1379825568.00,Canada,,1391087,Basic Industries,Precious Metals
SAP,SAP  SE ADS,$146.56,0.19,0.13%,172879148070.00,Germany,,480468,Technology,EDP Services
SAR,Saratoga Investment Corp New,$26.12,-0.42,-1.583%,292112263.00,United States,,28946,Finance,Finance Companies
SAVE,Spirit Airlines Inc. Common Stock,$25.59,-0.34,-1.311%,2774003342.00,United States,,5160011,Transportation,Air Freight/Delivery Services
SB,Safe Bulkers Inc Common Stock ($0.001 par value),$3.23,-0.14,-4.154%,385947299.00,Monaco,2008,736895,Transportation,Marine Transportation
SB^C,Safe Bulkers Inc Cumulative Redeemable Perpetual Preferred Series C (Marshall Islands),$25.1916,0.0116,0.046%,,Monaco,,3587,,
SB^D,Safe Bulkers Inc Perpetual Preferred Series D (Marshall Islands),$25.25,0.043,0.171%,,Monaco,,4939,,
SBBA,Scorpio Tankers Inc. 7.00% Senior Notes due 2025,$24.955,-0.015,-0.06%,0.00,Monaco,2020,13124,Transportation,Marine Transportation
SBH,Sally Beauty Holdings Inc. (Name to be changed from Sally Holdings Inc.) Common Stock,$18.63,-0.23,-1.22%,2105812615.00,United States,,513675,Miscellaneous,Diversified Commercial Services
SBI,Western Asset Intermediate Muni Fund Inc Common Stock,$9.77,0.06,0.618%,137584218.00,United States,1992,12276,Finance,Finance/Investors Services
SBII,Sandbridge X2 Corp. Class A Common Stock,$9.74,0.03,0.309%,289980507.00,,2021,10766,Finance,Finance: Consumer Services
SBOW,SilverBow Resorces Inc. Common Stock,$17.65,-0.50,-2.755%,215268190.00,,,175488,Energy,Oil & Gas Production
SBR,Sabine Royalty Trust Common Stock,$39.00,-0.93,-2.329%,568594455.00,United States,,26097,Energy,Oil & Gas Production
SBS,Companhia de saneamento Basico Do Estado De Sao Paulo - Sabesp American Depositary Shares (Each repstg 250 Common Shares),$6.85,0.06,0.884%,4682042603.00,Brazil,2002,953396,Public Utilities,Water Supply
SBSW,D/B/A Sibanye-Stillwater Limited ADS,$16.13,-0.40,-2.42%,11906299900.00,,,1352697,Basic Industries,Precious Metals
SC,Santander Consumer USA Holdings Inc. Common Stock,$41.50,-0.08,-0.192%,12702364862.00,,2014,703578,Finance,Finance Companies
SCCO,Southern Copper Corporation Common Stock,$65.23,-0.18,-0.275%,50428091177.00,United States,,663410,Basic Industries,Precious Metals
SCD,LMP Capital and Income Fund Inc. Common Stock,$14.48,0.19,1.33%,259414746.00,United States,2004,78508,Finance,Trusts Except Educational Religious and Charitable
SCE^G,SCE Trust II Trust Preferred Securities,$25.0598,-0.0902,-0.359%,,United States,,9871,,
SCE^H,SCE Trust III Fixed/Floating Rate Trust Preference Securities,$25.57,-0.17,-0.66%,,United States,,10668,,
SCE^J,Southern California Edison Company 5.375% Fixed-to-Floating Rate Trust Preference Securities,$25.04,-0.08,-0.318%,,United States,,37810,,
SCE^K,Southern California Edison Company 5.45% Fixed-to-Floating Rate Trust Preference Securities,$25.62,-0.10,-0.389%,,United States,,13095,,
SCE^L,SCE TRUST VI,$25.03,-0.07,-0.279%,,United States,,21592,,
SCHW,Charles Schwab Corporation (The) Common Stock,$73.42,1.49,2.071%,138495547842.00,United States,,6047702,Finance,Investment Bankers/Brokers/Service
SCHW^D,The Charles Schwab Corporation Depositary Shares each representing 1/40th interest in a share of 5.95% Non-Cumulative Perpetual Preferred Stock Series D,$25.72,0.04,0.156%,,United States,,55449,,
SCHW^J,The Charles Schwab Corporation Depositary Shares Each Representing a 1/40th Interest in a Share of 4.450% Non-Cumulative Perpetual Preferred Stock Series J,$26.65,-0.25,-0.929%,,United States,,38493,,
SCI,Service Corporation International Common Stock,$64.25,0.33,0.516%,10766919011.00,United States,,1394817,Miscellaneous,Other Consumer Services
SCL,Stepan Company Common Stock,$117.99,0.00,0.00%,2650746939.00,United States,,35901,Basic Industries,Specialty Chemicals
SCM,Stellus Capital Investment Corporation Common Stock,$13.00,-0.06,-0.459%,253318039.00,United States,2012,50181,Finance,Finance Companies
SCPE,SC Health Corporation Class A Ordinary Shares,$10.45,0.57,5.769%,238390625.00,,2019,105027,Finance,Business Services
SCS,Steelcase Inc. Common Stock,$13.75,-0.17,-1.221%,1590599340.00,United States,1998,227389,Consumer Durables,Office Equipment/Supplies/Services
SCU,Sculptor Capital Management Inc. Class A Common Stock,$25.24,0.60,2.435%,1466553542.00,United States,,309116,Finance,Investment Managers
SCVX,SCVX Corp. Class A Ordinary Shares,$9.90,0.00,0.00%,284625000.00,,2020,5325,Finance,Business Services
SCX,L.S. Starrett Company (The) Common Stock,$7.9587,0.1187,1.514%,56535055.00,United States,,4543,Consumer Durables,Home Furnishings
SD,SandRidge Energy Inc. Common Stock,$7.27,0.59,8.832%,265405214.00,,2016,1230229,Energy,Oil & Gas Production
SDHY,PGIM Short Duration High Yield Opportunities Fund Common Shares,$19.46,0.02,0.103%,480137670.00,,2020,34011,Finance,Finance/Investors Services
SE,Sea Limited American Depositary Shares each representing one Class A Ordinary Share,$307.14,4.42,1.46%,161074505804.00,United States,2017,1796591,Technology,Computer Software: Prepackaged Software
SEAH,Sports Entertainment Acquisition Corp. Class A Common Stock,$9.945,0.055,0.556%,559406250.00,United States,2020,284166,Finance,Finance: Consumer Services
SEAS,SeaWorld Entertainment Inc. Common Stock,$50.67,-1.73,-3.302%,4006080762.00,United States,2013,1158772,Consumer Services,Movies/Entertainment
SEE,Sealed Air Corporation Common Stock,$59.12,0.41,0.698%,8861663814.00,United States,,748312,Basic Industries,Containers/Packaging
SEM,Select Medical Holdings Corporation Common Stock,$35.86,-1.34,-3.602%,4825900345.00,United States,2009,660651,Health Care,Hospital/Nursing Management
SEMR,SEMrush Holdings Inc. Class A Common Stock,$20.96,0.64,3.15%,2842704611.00,,2021,174557,Technology,EDP Services
SF,Stifel Financial Corporation Common Stock,$68.04,0.36,0.532%,7129763817.00,United States,,576529,Finance,Investment Bankers/Brokers/Service
SF^A,Stifel Financial Corporation Depositary Shares each representing a 1/1000th interest in a share of 6.25% Non-Cumulative Preferred Stock Series A,$25.26,-0.04,-0.158%,,United States,,12770,,
SF^B,Stifel Financial Corporation Depositary Shares Each Representing 1/1000th  Interest in a Share of 6.25% Non-Cumulative  Preferred Stock Series B,$27.55,-0.04,-0.145%,,United States,,4930,,
SF^C,Stifel Financial Corporation Depositary Shares Each Representing 1/1000th Interest in a Share of 6.125% Non Cumulative Preferred Stock Series C,$27.7399,-0.0701,-0.252%,,United States,,14487,,
SF^D,Stifel Financial Corporation Depositary Shares Each Representing 1/1000th Interest in a Share of 4.50% Non-Cumulative Preferred Stock Series D,$25.69,-0.05,-0.194%,,United States,,40131,,
SFB,Stifel Financial Corporation 5.20% Senior Notes due 2047,$26.34,0.00,0.00%,0.00,United States,2017,7219,Finance,Investment Bankers/Brokers/Service
SFBS,ServisFirst Bancshares Inc. Common Stock,$73.40,-0.98,-1.318%,3978368374.00,United States,,123105,Finance,Major Banks
SFE,Safeguard Scientifics Inc. New Common Stock,$8.13,0.56,7.398%,170385060.00,United States,,355200,Finance,Finance/Investors Services
SFL,SFL Corporation Ltd,$6.73,-0.11,-1.608%,783097638.00,Bermuda,,991999,Transportation,Marine Transportation
SFTW,Osprey Technology Acquisition Corp. Class A Common Stock,$9.99,0.00,0.00%,394917188.00,,2019,190127,Technology,Radio And Television Broadcasting And Communications Equipment
SFUN,Fang Holdings Limited American Depositary Shares (Each representing Four Class A Ordinary Shares HK$1.00 par value),$10.07,0.07,0.70%,90682535.00,China,2010,288,Technology,EDP Services
SGFY,Signify Health Inc. Class A Common Stock,$28.09,0.56,2.034%,4719208062.00,,2021,564471,Technology,Retail: Computer Software & Peripheral Equipment
SGU,Star Group L.P. Common Stock,$10.76,-0.37,-3.324%,426158623.00,United States,,74586,Public Utilities,Oil Refining/Marketing
SHAK,Shake Shack Inc. Class A Common Stock,$89.95,-0.41,-0.454%,3780166920.00,United States,2015,799166,Consumer Services,Restaurants
SHG,Shinhan Financial Group Co Ltd American Depositary Shares,$34.10,0.13,0.383%,17615828256.00,South Korea,,42652,Finance,Major Banks
SHI,SINOPEC Shangai Petrochemical Company Ltd. Common Stock,$20.90,0.07,0.336%,2262177022.00,China,,15813,Basic Industries,Major Chemicals
SHLX,Shell Midstream Partners L.P. Common Units representing Limited Partner Interests,$12.43,0.03,0.242%,4888588945.00,United States,2014,1565371,Energy,Oilfield Services/Equipment
SHO,Sunstone Hotel Investors Inc. Sunstone Hotel Investors Inc. Common Shares,$11.07,-0.22,-1.949%,2424802213.00,United States,2004,3102233,Consumer Services,Hotels/Resorts
SHO^F,Sunstone Hotel Investors Inc. 6.450% Series F Cumulative Redeemable Preferred Stock,$25.16,-0.01,-0.04%,,United States,,25010,,
SHO^H,Sunstone Hotel Investors Inc. 6.125% Series H Cumulative Redeemable Preferred Stock,$26.82,0.00,0.00%,,United States,,869,,
SHO^I,Sunstone Hotel Investors Inc. 5.70% Series I Cumulative Redeemable Preferred Stock,$25.17,-0.04,-0.159%,,United States,,81392,,
